availability,name,price,url
In Stock,Fantech Hg17s 7.1 Headphone With Metal Headband And Flawless Sound-White,"3,299",https://www.sastodeal.com/fantech-hg17s-7-1-headphone-with-metal-headband-and-flawless-sound-white-fantech-hg17s-headphone-with-metal-headband-white.html
In Stock,Fantech MH82 Echo Multi Platform Gaming Headset,"4,999",https://www.sastodeal.com/fantech-mh82-echo-multi-platform-gaming-headset-sd-fan-tc-21.html
In Stock,Fantech HQ52 Tone Lightweight Gaming Headset,"2,999",https://www.sastodeal.com/fantech-hq52-tone-lightweight-gaming-headset-sd-fan-airph-1.html
In Stock,headp,"5,499",https://www.sastodeal.com/headp-fantech-mh87-multi-platform-gaming-headset-pink.html
In Stock,headp,"4,899",https://www.sastodeal.com/headp-fantech-mh87-multi-platform-gaming-headset-black.html
In Stock,Fantech Tower Ac3001S Rgb Headset Stand,"1,799",https://www.sastodeal.com/fantech-tower-ac3001s-rgb-headset-stand-ac3001s.html
In Stock,Fantech Earcup For HG11 Headset,799,https://www.sastodeal.com/fantech-earcup-for-hg11-headset-earcup-hg11.html
In Stock,FANTECH Replacement Sponge Ear Cup For Fantech Headphone HG15,759,https://www.sastodeal.com/fantech-replacement-sponge-ear-cup-for-fantech-headphone-hg15-earcup-hg15.html
In Stock,Fantech RGB Earphone Game HG22 Earphones With Microphone USB 7.1 Surround Sound Wired Gaming Headset,"6,899",https://www.sastodeal.com/fantech-rgb-earphone-game-hg22-earphones-with-microphone-usb-7-1-surround-s-sd-fan-airph-6.html
In Stock,Fantech HG23 Headphone Personalize With Octane 7.1 RGB USB Just Wired Gaming Headset Alloy Earmuffs For PC PS4 Gaming Headphones,"5,699",https://www.sastodeal.com/fantech-hg23-headphone-personalize-with-octane-7-1-rgb-usb-just-wired-gamin-sd-fan-tc-16.html
In Stock,Fantech Hg11 7.1 Channel Surround Sound Gaming Headset Stereo Led Headphones,"4,499",https://www.sastodeal.com/fantech-hg11-7-1-channel-surround-sound-gaming-headset-stereo-led-headphone-hg11.html
In Stock,Fantech MH83 Adjustable Over Ear Gaming Headphone RGB Light Noise Cancelling Gaming Headset 7.1,"6,299",https://www.sastodeal.com/fantech-mh83-adjustable-over-ear-gaming-headphone-rgb-light-noise-cancellin-sd-fan-tc-22.html
In Stock,FANTECH Chief II HG20 Gaming Headphone,"2,999",https://www.sastodeal.com/fantech-chief-ii-hg20-gaming-headphone-hg20.html
In Stock,headp,"5,499",https://www.sastodeal.com/headp-fantech-mh87-multi-platform-gaming-headset-white.html
In Stock,FANTECH Spectre II HG24 Wired Gaming 7.1 Channel Headphones,"4,299",https://www.sastodeal.com/fantech-spectre-ii-hg24-wired-gaming-7-1-channel-headphones-hg24.html
In Stock,Fantech HG21 Earphones With Microphone 7.1Surround Sound Gaming Headset USB Wired Gaming Headset For PC NS SWITCH Earphone Gamer,"5,999",https://www.sastodeal.com/fantech-hg21-earphones-with-microphone-7-1surround-sound-gaming-headset-usb-sd-fan-tc-15.html
In Stock,Fantech Ac3001 Headset Stand,999,https://www.sastodeal.com/fantech-ac3001-headset-stand-ac3001.html
